タイムスタンプ,メールアドレス,お名前（フルネーム）,（１）全体的な感想,（２）あなたの現状の課題にはどんなものがありましたか？,（３）今回の受講で、それについてどんな気づきや実践の可能性を発見しましたか？,（４）具体的に役に立つと感じたトピックを3つ教えてください。,（５）今日の講座の内容の理解を深めるための質問があれば、記入してください。,（６）神先生にメッセージをお願いします。
2025/10/12 14:58:07,nagashigemakiko@gmail.com,永重テスト,テスト,テスト,テスト,テスト,テスト,テスト
2025/10/12 19:15:09,dr.feriz.sapporo@gmail.com,今野クニコ,役にたつ内容でとてもありがたいです！,コアニーズの満たし方,神先生に質問した時に、実践で答えを頂いて、理解がしやすかったので、自分で話しながら自分で気付ける発見をしました！,"旅の連れ合いとツアーガイド。
コアニーズの満たし方。
主な変容プロセス。",講座内で解決しました。,"今日もありがとうございました！
質問の時に、私が理解できるように答えをくださり、とても嬉しかったです。
次回もよろしくお願いいたします！"
2025/10/12 19:32:23,akito_carp@yahoo.co.jp,田口朗楽,"クライアントが話している内容によって、ツアーガイドかコンパニオンか使い分けるのは、今まで意識していなかったので、今後使っていきます。
また、3つのコアニーズを満たす聴き方もすごく参考になり、練習していこうと思います。",有能感を伝えるのができていない。,神先生の有能感の伝え方が、自然にクライアントの気づきを引き出していてとても参考になり、動画を見直して練習します。,"コアニーズを満たす
ツアーガイドかコンパニオンか
一言に凝縮する",有能感を伝えるために、意識して聞くといいクライアントの言葉があれば教えてください。,"今日の講座もすごく役に立つ内容でした。
ありがとうございました。"
2025/10/12 20:29:16,junxiongyecun@gmail.com,のむら としお,"前回の講義でも感じましたが今回のワークを実践し、私は話を聴く時に話の内容ばかりに興味関心が向いて、それ以外の非言語の要素や話の背景等にあまり注目しない傾向があることを再確認できました。前回から相手が話している時の非言語の要素にも意識を向けることを自分なりに実践し、それなりにできたりあまりできなかったりを繰り返していますが、自分の中で相手の話し方や話している様子に意識を向けることが少しずつできるようになってきていることが嬉しいです。

今回の講義で特に印象に残っているのがレポートとコマンドです。相手がこちらに伝えるメッセージにはレポート(報告)とコマンド(要請、操作)という二つの側面がある。相手は言語と帆言語を通して、どのように関わってほしいのか、何を求めているのかということを伝えている。これを意識していきます。","・相手の話の内容ばかりに興味関心が向いて、非言語の要素や話の背景に意識が向きにくいところがある。

・ワーク中に感じたこととして、自分が話している時に話の内容を整理できてない、まとまっていないと自分の中で感じて、緊張や焦りが湧いてくることがよくあることに気がついた。","前回や今回のワークで話の内容以外に意識を向けることで、相手をより広く全体的に分かろうとすることができることを感じた。今回のワークで相手の表情やしぐさ、声の調子にこちらが反応することで相手も反応することを体験できたので、リアルタイムで瞬時に相手の非言語や様子に関わることが大事だと学んだ。

適切な言葉で伝え返しや応答をしなければという思いが自分の中にあり、もちろん適切な言語として伝え返しができるのがベストだけど、それよりもリアルタイムの瞬時の反応・関わりによって相手の心が動くことがあればそれでいいのではないかと思った。

これまで過去に感情がないとか人間じゃないと言われたこともあったけど、自分の中にちゃんとしなければいけないという思い込みがあって、でも同時にちゃんとできていないと思ってしまうから緊張や焦りが生じる。

人との関りにおいて正解があると思うよりも、その場で相手との間で生み出していくものが関りだと思う方がいいように思った。自分は感情や気持ちの交流をしたいのだと感じた。","・識別傾聴をして不一致の部分があったら見逃さず、不一致の部分が複数あったら相手のパターンとして認識できる。
・コミュニケーションは要請・操作のし合い。
・自律性、有能感、関係性のコアニーズを満たす関りを意識する。",たとえば今回の神先生と仲西ととさんのデモンストレーションの際にととさんが最初に椅子を座り直した動作を見逃さないことがありましたが、相手をよく観察(視覚以外の聴覚等の感覚も含めて)するために神先生が意識していることやトレーニング方法、あるいは観察する時に大切なことがあれば教えていただきたいです。,これまでにない学びをたくさんできています。いつもありがとうございます。次回も楽しみです！
2025/10/12 22:28:10,sakanashi.kalin@gmail.com,坂梨禾森（濵中まゆみ）,時間が経つのがとても早く感じました。1回目の講座の中身が結びついた感じです。,あれもこれもやらなければと思うと、焦ってしまい、落ち着いて考えられない。練習量が足りない。,セッションにおいて常に今求められている役割を意識することと、変化の方向に向けてCLが受け止められるよう道筋を提示する。,精緻化と戦略化/コアニーズの満たし方/ひとこと技法,こうすけさんとのセッションにおいて「『情けない』は感情ではないから、他の言葉で」と語りかけていらっしゃいました。「情けない」は感情ではないとは言い切れないとは思うのですが（また、他の方のケースの場合は、感情として「情けない」と出たのはそのまま扱われていました。）、あの場合は、こうすけさんの状態から、別の感情を引き出すために「情けないは感情ではない」とおっしゃったのだと理解していますが、それでよろしいでしょうか？,今回は、リアルタイムで参加できて、ワークもできたので、動画を見るだけより、学べることが多かったです。
2025/10/13 20:54:47,mtszkmsy@gmail.com,松崎雅代,"初めての提出でごめんなさい。
いつも終わった後頭が一杯一杯で、日常に戻ると気がつくと期限が切れているという状態が続いてしまっていました。

毎回ですが、先生の説明一つひとつを理解したくてずっと真剣に聞いているのですが、のめり込んで聞いて、また凄く納得して聞いて、このように体系的に教えていただけることが自分にとってとても価値があると毎回感じながら受講させていただいています。","ビリーフチェンジのカウンセリングの受講では見立て（診断的）の視点を持つことは若干意識できたものの、全体的に学んできたコーチングも含めなんとなく進めていたところがあると痛感しました。
今回のDAY5を通して、支援者側に明確な意図や方向性を持つということが必須だということを感じ、そこが私の課題でもあると思います。","気付きは、聴き方の時点でコンパニオン・ガイド２つの顔を入れ替えながらという視点をまず自分のものにするだけでも大きな差が差が出てくるという事。

そしてレポートとコマンドは自分が日常の会話で何となく「ある」と感じていたこと、例えば友達の相談など、聞いて欲しいだけなのか、アドバイスが欲しいのかはいつも考えながら接しているところが昔からあるのですが、アカデミック的に理解できて、これも確実に自分のものにしていくだけでも、プロとして確実にレベルが上がると思います。

実戦の可能性は、ひとこと技法はかなり核心に迫れるやり方だと練習と神先生へ質問させていただいた際の回答の事例のおかげでその鋭さを臨場感持って理解できたことで、これを使いこなせるようになるとそのままセッションに使えると思いました。

自分の場合、何が根っこの問題なのかを理解するまでに30分くらいヒアリングしてしまう（何を聞けば何を引き出せるという流れがまだ頭の中で体系化されていない）ので、その課題もこの講義の内容をもう少し深堀して練習すると、解決されそうな可能性も感じました。

今後の支援の関わり方としてのプロ意識が、「まだちゃんとできるか不安」から「これができるようになれば私もできるようになる！」という意欲に着実に変換されてきています。",コンパニオン/ガイド、レポートとコマンド、ひとこと技法,ひとこと技法の最後のアイデンティティを出していく質問において、メタファーから思い起こされる「〇〇は〜〜だと感じる」という考え方や概念が引き出せると、これがその方のビリーフに該当するという理解で合っていますでしょうか。,"いつも惜しみなく先生のお持ちの知識を教えていただきまずお礼をお伝えしたいです。

先生のお話はビデオで見返しても毎回新しい気づきがあり、またリアルで参加できる時はもっと質問などさせていただけるありがたい機会なのに、変なことを言ってしまったらどうしようと思って、あまり質問できずにいたりするのですが、考えすぎずにもっと質問させていただこうと思います。

トトさんと練習をさせていただいたどこかの内容で、神先生のようになりたい！と大胆なことを言ってしまいましたが、ご本人にお伝えしたら喜ばれると仰っていたので、大胆ですが書いてみました。

私は妊娠・出産の期間に旦那さんが自殺病棟に入るくらいの鬱になり、心理学の大学を遠い昔卒業し、対人支援をしたいという割に、一番大切な人を一番大切な時にサポートしてあげられる知識も経験も十分になかったことが本当に不甲斐なく辛かったのですが、今はそれこそが原動力になって本気で人を救えるプロになりたいと思っています。

そのための莫大な知識を先生はお持ちでいらっしゃると毎回感じ取るものがあり、より真剣に今までの振り返りもしつつ、今後も受講させていただきたいと思っています！"
2025/10/18 23:23:25,cocoriosp0817@gmail.com,荒木美紀,目からウロコが何度か剥がれ落ちました。クライアントの話を聴くのは自分の理解のためではなくて介入のためだったんだとか、語られていないことを聞くってこういう事なのか、とか、相手のコアニーズを満たすってこんな感じなんだとか感じた場面で、です。,伝え返しをするのも忘れて、ついついこちらのペースで会話を進め、相手を置き去りにしてしまうという課題があります。,相手のコアニーズを全く満たしていないことに気がつき、ショックを受けました。まずは相手に貢献したいという純粋な気持ちを持つことから始めます。それと相手のコマンドに意識を向けます。,"●レポートとコマンド
●精緻化（コインの裏表：語られていないことに目を向ける）
●セッションでコアニーズを満たす",ひとこと技法のワークでクライアント役の時に気になったのですが、「まるで～～のよう」とアナロジーに変える時は自分を客観的に見て例えるのでしょうか？それともアソシエイトの状態で例えるのでしょうか？,竹村健一、懐かしいです。久しぶりに思い出しました。
2025/10/19 23:58:43,leialohapikake@gmail.com,稲岡純子,本日は途中まで音声のみで受講する時間があったのですが、まるで先生が私に語りかけてくれているような感覚に陥りました。講座で教えてくださるものは全て私の課題上にあることですが、先生の話される言葉が、本日は更に身に染みました。,クライアントの話を聴く時に、言葉を全部聞いてしまい、大事なことを逃してしまうこと。,様々な聴き方と方向づけを学べたことで、セッション以外での聴き方が変わってきた気がしています。セッションではまだまだ流れを意識していたり、緊張していたりで、聴き方が出来ていません。,・ひとこと技法　・コアニーズの満たし方　・ツアーガイドと旅の連れ合い,"旅の「連れ合い」か「ツアーガイド」かを選ぶチョイスポイントのワークで、1分聴いた後にチョイスポイントを選び、その後の話の再開時に、ペアになったアシスタントの方が「連れ合い」でも「ツアーガイド」でも、「それはどうしてそう思ったのですか？」という問いを渡してくださいました。
この問いの使い分けは、こちらの聴く姿勢に軸があれば、クライアントの答えは自然とその方向に向かうものなのでしょうか。","バディスポーツに子どもを通わせておりました。
他県からでしたが、イベントの際にはよくはるひ野園にお邪魔しており、近隣の皆さまの温かいお心遣いに支えられて、子どもたちは成長することができました。
本当にありがとうございました。"
2025/10/19 23:59:24,hiroko.e.777@gmail.com,遠藤裕子（えんどうひろこ）,今回も内容盛りだくさんで、アーカイブを何度も見直して、それでもやっとなんとかわかったかな…って感じです（汗）でも楽しいです。,クライアントとのラポール形成、言葉の奥にある本当の気持ちを聴くこと。,コンパニオンがツアーガイドか自分の関わり方を決めて話を聴きく。チェックイン、チェックアウトで確認しながら進めること。三つのコアニーズは自分が満たでばよい。そうするこで治療連合として、変化の推進力も増す。,精緻化と戦略性、セッションにおけるコアニーズの満たし方、穏やかに言語化を促すテンプレート,有能感をどう満たしたらいいのか質問させて頂き、お答え頂きありがとうございました。再度、アーカイブを見直し、神先生が仰ってくれた、能力、リソース、承認、発見の幾つかは自分でも発見出来ていたことに気づきました。しかし、それをどの様に伝えていいのか分からなくて言葉に出来なかった部分があります。見つけたものを矢継ぎ早とまではいかなくても、一つ一つに相手に伝える？それとも、一つずつ取り上げて、より掘り下げて話を聴いていくのがいいのですか？,