タイムスタンプ,メールアドレス,お名前（フルネーム）,（１）全体的な感想,（２）今日の講座内容に関連した、あなたの現状の課題にはどんなものがありますか？,（３）今回の受講で、それについてどんな気づきや実践の可能性を発見しましたか？,（４）具体的に役に立つと感じたトピックを3つ教えてください。,（５）今日の講座の内容の理解を深めるための質問があれば、記入してください。,（６）神先生にメッセージをお願いします。
2025/11/05 21:26:49,ayumiiiii0318@gmail.com,竹原テスト,テスト,テスト,テスト,テスト,テスト,テスト
2025/11/05 22:30:58,akito_carp@yahoo.co.jp,田口朗楽,4MATを自分で作ってきましたが、講座内でさらに深く学べて良かったです。,"・4MATの上２つの感情で語る部分をしゃべるのが苦手
・自律神経の乱れで…は順番が逆
・HOW～IFの完成度がまだ低い",感情を出して相手に伝えるのが苦手なところをアシスタントさんに教えてもらって、良い気づきになりました。マスタークラブで練習していきます。,"・主訴をしっかり言う。（自律神経の乱れで～ではなく、～の症状は実は…）
・４MATの上半分を伝わりやすいように練習する
・その症状で悩んでいる人が言う事を想像してセリフを言う","セッションの流れを言うときは、ストーリー立てて言っていく方が良いのでしょうか？
たとえば、まず、○○のために××をやっていきます、そして…のように","最近、無料セッションを始めて、１件成約をもらうことができました。
やはり実践していくことが自分の成長に繋がると実感しています。
言語学の内容を少しずつですが、セッション中にも意識できていると思います。
ありがとうございます。"
2025/11/06 23:31:26,dr.feriz.sapporo@gmail.com,今野クニコ,声が出なくて耳だけ参加でワークができなかったのですが、どんなに下手くそな自分でもワークをする時の方が内容を腑に落とせるのだと感じました。,4MATに落とし込む内容がまだちゃんとまとまっていないことです。,自分が伝えたいことと、相手に伝えるべきことが一致する内容を見つけようと思いました、,"・WHYは個別相談、申し込みのときに厚くやる。
・WHYのところで3つくらい現象を言う。
・聞いておきたいことはありますか？は、いつ聞いてもいいわけじゃない。
",実際に4MATに当てはめていなくて質問がありません。,今回は耳だけ参加になりとても残念でしたが、引き続きよろしくお願いします！
2025/11/12 9:20:44,sakanashi.kalin@gmail.com,坂梨禾森（濵中まゆみ）,オンタイムで参加しないと損してるなぁと思いました。,今は対象を教員に限っていますが、対象を広げて考えたい。まずは、４MATの空欄を埋める。,対象を広げて４MATを考えたいと思い始めました。,WHY・WHATまでは続けて言う/特徴３つ/セッションの流れ,今はありません。（動画を見て、４MATを考えるのでいっぱいいっぱいです。）,オンタイムでの参加が難しい日が続いています。動画視聴で自習がんばります。